{
  "protocol_version": 1,
  "type": "seat.updated",
  "room_id": 1,
  "hand_id": null,
  "version": 26,
  "server_time": "2026-10-27T14:03:05.120Z",
  "payload": {
    "seat": 3,
    "occupant": {
      "seat": 3,
      "player_id": "2",
      "display_name": "An",
      "stack": 945,
      "sitting_out": true,
      "connected": true
    }
  }
}
