{
  "protocol_version": 1,
  "type": "seat.updated",
  "room_id": 1,
  "hand_id": 41,
  "version": 19,
  "server_time": "2026-10-27T14:03:20.300Z",
  "payload": {
    "seat": 5,
    "occupant": {
      "seat": 5,
      "player_id": "3",
      "display_name": "Bình",
      "stack": 1000,
      "sitting_out": false,
      "connected": true,
      "leaving": true
    }
  }
}
